{"schema_version":"1.0","engine_version":"0.1.0","language":"cpp","submissions":[{"submission_id":"template","source":"#include <iostream>\r\n#include <vector>\r\nusing namespace std;\r\n\r\nint main() {\r\n    int count;\r\n    cin >> count;\r\n\r\n    vector<string> studentNames(count);\r\n    vector<int> studentGrades(count);\r\n\r\n    for (int i = 0; i < count; i++) {\r\n        cin >> studentNames[i];\r\n        cin >> studentGrades[i];\r\n    }\r\n\r\n    for (int i = 0; i < count; i++) {\r\n        cout << studentNames[i] << \" -> \" << studentGrades[i] << \"\\n\";\r\n    }\r\n}"},{"submission_id":"student","source":"#include <iostream>\r\nusing namespace std;\r\n\r\nint main() {\r\n    int n;\r\n    cin >> n;\r\n\r\n    int sum = 0;\r\n\r\n    for (int i = 0; i < n; i++) {\r\n        int grade;\r\n        cin >> grade;\r\n        sum += grade;\r\n    }\r\n\r\n    cout << sum / (double)n << endl;\r\n    return 0;\r\n}"}],"params":{"k_gram":5,"window":10,"gst_min_match":10,"top_k":5}}